<?xml version="1.0" encoding="UTF-8"?>
<!-- W3C Schema generated by XMLSpy v2021 rel. 3 (x64) (http://www.altova.com) -->
<xs:schema xmlns:xs="http://www.w3.org/2001/XMLSchema">
	<xs:element name="Code">
		<xs:simpleType>
			<xs:restriction base="xs:string">
				<xs:maxLength value="20"/>
			</xs:restriction>
		</xs:simpleType>
	</xs:element>
	<xs:element name="DescriptionEn">
		<xs:simpleType>
			<xs:restriction base="xs:string">
				<xs:maxLength value="4000"/>
			</xs:restriction>
		</xs:simpleType>
	</xs:element>
	<xs:element name="RC">
		<xs:complexType>
			<xs:sequence>
				<xs:element ref="Code"/>
				<xs:element ref="DescriptionEn" minOccurs="0"/>
			</xs:sequence>
		</xs:complexType>
	</xs:element>
	<xs:element name="RulesCondition">
		<xs:complexType>
			<xs:sequence>
				<xs:element ref="RC" maxOccurs="unbounded"/>
			</xs:sequence>
		</xs:complexType>
	</xs:element>
</xs:schema>